### ISSUE TITLE
Should it still work today?

### ISSUE THREAD

**Issue by JonasVautherin** [kaos/wireshark-plugins#5]
I tried installing the plugin, but wireshark does not seem to detect any capnp messages. I also tried to save the capture and run:

```
tshark -r capnptest.pcapng -Y capnp
```

But I don't get any output. With the `-O` variant, it still doesn't seem to look like what I was understanding from the README:

```
% tshark -r capnptest.pcapng -O capnp                                                                                              [0]
Frame 1: 74 bytes on wire (592 bits), 74 bytes captured (592 bits) on interface lo, id 0
Ethernet II, Src: 00:00:00_00:00:00 (00:00:00:00:00:00), Dst: 00:00:00_00:00:00 (00:00:00:00:00:00)
Internet Protocol Version 4, Src: 127.0.0.1, Dst: 127.0.0.1
Transmission Control Protocol, Src Port: 50896, Dst Port: 14111, Seq: 0, Len: 0

Frame 2: 74 bytes on wire (592 bits), 74 bytes captured (592 bits) on interface lo, id 0
Ethernet II, Src: 00:00:00_00:00:00 (00:00:00:00:00:00), Dst: 00:00:00_00:00:00 (00:00:00:00:00:00)
Internet Protocol Version 4, Src: 127.0.0.1, Dst: 127.0.0.1
Transmission Control Protocol, Src Port: 14111, Dst Port: 50896, Seq: 0, Ack: 1, Len: 0

Frame 3: 66 bytes on wire (528 bits), 66 bytes captured (528 bits) on interface lo, id 0
Ethernet II, Src: 00:00:00_00:00:00 (00:00:00:00:00:00), Dst: 00:00:00_00:00:00 (00:00:00:00:00:00)
Internet Protocol Version 4, Src: 127.0.0.1, Dst: 127.0.0.1
Transmission Control Protocol, Src Port: 50896, Dst Port: 14111, Seq: 1, Ack: 1, Len: 0

Frame 4: 114 bytes on wire (912 bits), 114 bytes captured (912 bits) on interface lo, id 0
Ethernet II, Src: 00:00:00_00:00:00 (00:00:00:00:00:00), Dst: 00:00:00_00:00:00 (00:00:00:00:00:00)
Internet Protocol Version 4, Src: 127.0.0.1, Dst: 127.0.0.1
Transmission Control Protocol, Src Port: 50896, Dst Port: 14111, Seq: 1, Ack: 1, Len: 48
Data (48 bytes)
```

What could I be missing?

**Comment by JonasVautherin** [comment]
Sorry, my bad. I had to right click > "Decode As...", I was hoping it would be detected automatically somehow.
